{
  "schema_version": "2.0",
  "task_id": "155-260924-opds-코덱스-세션-이관-복구",
  "locked": true,
  "created_at": "2026-09-24T14:53:11+09:00",
  "locked_at": "2026-09-24T14:54:56+09:00",
  "scenarios": [
    {
      "id": "S-1",
      "acceptance_ref": "AC-1, C-1",
      "type": null,
      "expected": "실제 입력 신원 해석, 공백/누락은 미해석, core에 플랫폼 변수 리터럴 없음",
      "red_required": true,
      "red_confirmed": true,
      "red_evidence": "python -m pytest opal/tools/ownership-tool/tests/test_codex_identity.py -q; exit=1; CODEX_SESSION_ID only resolves None, expected native input; run/red-ownership.txt; 3 failed 5 passed",
      "red_at": "2026-09-24T14:54:55+09:00",
      "required_fidelity": "mock",
      "surface_ref": null,
      "surface_kind": null,
      "profile": null,
      "actors": [],
      "steps": [],
      "assertions": [],
      "required_evidence": [],
      "handoff": null,
      "result": "pass",
      "operational_status": null,
      "observed_executors": [],
      "assertion_results": [],
      "observed_evidence": [],
      "handoff_state": null,
      "run_id": null,
      "evidence": "Independent ownership suite:165 passed; state native ownership:9 passed; native-only status and invalid input tests pass. Core platform literal AST scan empty. run/independent-ownership.txt, independent-state.txt, independent-security.json",
      "marked_at": "2026-09-24T15:07:32+09:00",
      "fidelity": "mock"
    },
    {
      "id": "S-2",
      "acceptance_ref": "AC-1, C-1",
      "type": null,
      "expected": "OPAL 우선·기존 Claude 우선순위 보존·payload fallback",
      "red_required": false,
      "red_confirmed": false,
      "red_evidence": null,
      "red_at": null,
      "required_fidelity": "mock",
      "surface_ref": null,
      "surface_kind": null,
      "profile": null,
      "actors": [],
      "steps": [],
      "assertions": [],
      "required_evidence": [],
      "handoff": null,
      "result": "pass",
      "operational_status": null,
      "observed_executors": [],
      "assertion_results": [],
      "observed_evidence": [],
      "handoff_state": null,
      "run_id": null,
      "evidence": "Independent ownership suite:165 passed; neutral/Claude/native and payload fallback expectations preserved; test_codex_identity test_s2 and invalid-native parameter tests pass. run/independent-ownership.txt",
      "marked_at": "2026-09-24T15:07:33+09:00",
      "fidelity": "mock"
    },
    {
      "id": "S-3",
      "acceptance_ref": "AC-2, C-5",
      "type": null,
      "expected": "공개 handoff가 명시 ID로 성공, 새 세션 기동 1회",
      "red_required": true,
      "red_confirmed": true,
      "red_evidence": "python -m pytest opal/tools/worktree-launcher/tests/test_codex_handoff.py -q; exit=1; explicit hub-explicit with ambient-other returns lease_handoff_failed; run/red-launcher.txt",
      "red_at": "2026-09-24T14:54:56+09:00",
      "required_fidelity": "mock",
      "surface_ref": null,
      "surface_kind": null,
      "profile": null,
      "actors": [],
      "steps": [],
      "assertions": [],
      "required_evidence": [],
      "handoff": null,
      "result": "pass",
      "operational_status": null,
      "observed_executors": [],
      "assertion_results": [],
      "observed_evidence": [],
      "handoff_state": null,
      "run_id": null,
      "evidence": "Independent launcher suite:148 passed,4 existing optional live skips; fixed RED explicit hub-explicit versus ambient-other test passed; real lease handoff observed before single adapter call. run/independent-launcher.txt",
      "marked_at": "2026-09-24T15:07:33+09:00",
      "fidelity": "mock"
    },
    {
      "id": "S-4",
      "acceptance_ref": "AC-2, AC-5, C-5",
      "type": null,
      "expected": "handoff와 같은 ID로 cancel, 허브 lease 복원",
      "red_required": true,
      "red_confirmed": true,
      "red_evidence": "python -m pytest opal/tools/worktree-launcher/tests/test_codex_handoff.py -q; exit=1; after actual handoff adapter changes ambient identity, cancel leaves handoff_pending instead of active; run/red-launcher.txt",
      "red_at": "2026-09-24T14:54:56+09:00",
      "required_fidelity": "mock",
      "surface_ref": null,
      "surface_kind": null,
      "profile": null,
      "actors": [],
      "steps": [],
      "assertions": [],
      "required_evidence": [],
      "handoff": null,
      "result": "pass",
      "operational_status": null,
      "observed_executors": [],
      "assertion_results": [],
      "observed_evidence": [],
      "handoff_state": null,
      "run_id": null,
      "evidence": "Independent launcher suite:148 passed; fixed RED ambient changes after handoff test passed; same explicit identity cancellation restores active hub lease and one terminal close. run/independent-launcher.txt",
      "marked_at": "2026-09-24T15:07:33+09:00",
      "fidelity": "mock"
    },
    {
      "id": "S-5",
      "acceptance_ref": "AC-3, AC-4, AC-6, C-2, C-4, C-6, H-1, H-2, H-3",
      "type": null,
      "expected": "수동 OPAL export 없이 native ID 사용, registry worktree_session_owned와 live lease owner 일치, 허브 writer 종료, 실제 terminal receipt 및 결과 존재",
      "red_required": false,
      "red_confirmed": false,
      "red_evidence": null,
      "red_at": null,
      "required_fidelity": "mock",
      "surface_ref": null,
      "surface_kind": null,
      "profile": null,
      "actors": [],
      "steps": [],
      "assertions": [],
      "required_evidence": [],
      "handoff": null,
      "result": "pass",
      "operational_status": null,
      "observed_executors": [],
      "assertion_results": [
        {
          "id": "raw_thread_matches",
          "expected": true,
          "actual": true
        },
        {
          "id": "parent_distinct",
          "expected": true,
          "actual": true
        },
        {
          "id": "neutral_not_inherited",
          "expected": true,
          "actual": true
        },
        {
          "id": "cli_success",
          "expected": true,
          "actual": true
        },
        {
          "id": "raw_owners_match",
          "expected": true,
          "actual": true
        },
        {
          "id": "active_worktree_owner",
          "expected": true,
          "actual": true
        },
        {
          "id": "claim_generation_increased",
          "expected": true,
          "actual": true
        },
        {
          "id": "heartbeat_increased",
          "expected": true,
          "actual": true
        },
        {
          "id": "heartbeat_generation_stable",
          "expected": true,
          "actual": true
        },
        {
          "id": "lease_live",
          "expected": true,
          "actual": true
        },
        {
          "id": "receipt_match",
          "expected": true,
          "actual": true
        },
        {
          "id": "bootstrap_body_match",
          "expected": true,
          "actual": true
        },
        {
          "id": "exact_terminal_closed",
          "expected": true,
          "actual": true
        }
      ],
      "observed_evidence": [
        "real_codex_events",
        "raw_lease_registry",
        "installed_hashes",
        "terminal_close"
      ],
      "handoff_state": null,
      "run_id": null,
      "evidence": "Structured expected/actual and required/observed evidence: run/independent-real-verdict.json. CLI terminal runtime has no E2E browser/API profile, so legacy mark preserves accurate fidelity. Independent raw thread/native parent distinction, no neutral inheritance, lease generation1->2, strict heartbeat increase, live lease and registry owner identity, receipts and exact terminal cleanup verified in run/independent-e2e-raw-check.json and real-e2e-final/. Source installed7hash plus bootstrap body match verified. Early child claim and foreign live owner unchanged tested in independent-launcher.txt (148pass). Public session-launch strips all parent identities while command payload preserved (independent-ownership.txt165pass).",
      "marked_at": "2026-09-24T15:11:45+09:00",
      "fidelity": "real-usage"
    },
    {
      "id": "S-6",
      "acceptance_ref": "AC-3, AC-4, C-2, C-5, H-2",
      "type": null,
      "expected": "child≠hub, generation 증가·heartbeat 갱신, 두 순서 owner 정합, foreign live lease 불변·거부",
      "red_required": false,
      "red_confirmed": false,
      "red_evidence": null,
      "red_at": null,
      "required_fidelity": "mock",
      "surface_ref": null,
      "surface_kind": null,
      "profile": null,
      "actors": [],
      "steps": [],
      "assertions": [],
      "required_evidence": [],
      "handoff": null,
      "result": "pass",
      "operational_status": null,
      "observed_executors": [],
      "assertion_results": [],
      "observed_evidence": [],
      "handoff_state": null,
      "run_id": null,
      "evidence": "Structured expected/actual and required/observed evidence: run/independent-real-verdict.json. CLI terminal runtime has no E2E browser/API profile, so legacy mark preserves accurate fidelity. Independent raw thread/native parent distinction, no neutral inheritance, lease generation1->2, strict heartbeat increase, live lease and registry owner identity, receipts and exact terminal cleanup verified in run/independent-e2e-raw-check.json and real-e2e-final/. Source installed7hash plus bootstrap body match verified. Early child claim and foreign live owner unchanged tested in independent-launcher.txt (148pass). Public session-launch strips all parent identities while command payload preserved (independent-ownership.txt165pass).",
      "marked_at": "2026-09-24T15:11:46+09:00",
      "fidelity": "real-usage"
    },
    {
      "id": "S-7",
      "acceptance_ref": "AC-5, C-5",
      "type": null,
      "expected": "preflight 미해석은 상태 불변, 실패 terminal 정확히 1개 정리·hub_owned 원복, cause/adapter/source 이름 관측·ID 원문 불필요 노출 없음",
      "red_required": false,
      "red_confirmed": false,
      "red_evidence": null,
      "red_at": null,